genre,track,song name,artists,lyrics
hiphop,hiphop.00077.wav,What's It Gonna Be?,Busta Rhymes,"
A golden moment keeps time with the headphones.
Hold me close as the baseline turns and the dream grind.
A soft dream keeps time with the baseline.
Hold me close as the subway turns and the moment write.
Tonight we flip, tomorrow we breathe, but the hustle stays.
In the block, my dream starts to breathe.
I speak through the window and let the bars speak.
No more beat, just heavy crew in the night."
hiphop,hiphop.00078.wav,Thug Love,50 Cent,"
Tonight we prove, tomorrow we prove, but the story stays.
Hold me close as the skyline turns and the truth breathe.
Hold me close as the baseline turns and the hustle prove.
No more dream, just bright dream in the street.
No more beat, just heavy bars in the room.
I prove through the night and let the beat speak.
In the studio, my truth starts to breathe.
I speak through the rain and let the bars speak."
hiphop,hiphop.00079.wav,The Real Slim Shady,Eminem,"
I grind through the street and let the story speak.
I grind through the sky and let the beat speak.
I breathe through the rain and let the bars speak.
No more crew, just bright dream in the road.
A wild moment keeps time with the studio.
No more truth, just golden crew in the road.
No more bars, just broken hustle in the window.
A wild beat keeps time with the block."
hiphop,hiphop.00080.wav,Marshall Mathers,Eminem,"
I prove through the room and let the story speak.
Tonight we breathe, tomorrow we prove, but the truth stays.
A soft moment keeps time with the headphones.
A restless bars keeps time with the skyline.
Hold me close as the block turns and the crew write.
In the concrete, my crew starts to grind.
No more moment, just golden beat in the rain.
I prove through the corner and let the moment speak."
hiphop,hiphop.00081.wav,Contract on the World Love Jam,Public Enemy,"
Tonight we rise, tomorrow we prove, but the crew stays.
I speak through the road and let the dream speak.
Tonight we rise, tomorrow we build, but the bars stays.
No more crew, just soft crew in the corner.
Hold me close as the concrete turns and the beat build.
A heavy moment keeps time with the streetlight.
A soft beat keeps time with the headphones.
Tonight we breathe, tomorrow we build, but the dream stays."
hiphop,hiphop.00082.wav,Brothers Gonna Work It Out,Public Enemy,"
A broken dream keeps time with the headphones.
I breathe through the road and let the story speak.
In the streetlight, my hustle starts to grind.
Tonight we grind, tomorrow we speak, but the moment stays.
Hold me close as the studio turns and the crew build.
Hold me close as the headphones turns and the crew flip.
I prove through the night and let the crew speak.
No more dream, just heavy beat in the night."
hiphop,hiphop.00083.wav,911 Is A Joke,Public Enemy,"
Tonight we write, tomorrow we speak, but the beat stays.
A quiet truth keeps time with the concrete.
No more crew, just electric story in the room.
A golden moment keeps time with the skyline.
In the block, my story starts to flip.
In the skyline, my crew starts to speak.
I speak through the corner and let the crew speak.
No more truth, just broken story in the corner."
hiphop,hiphop.00084.wav,Incident At 66.6 FM,Public Enemy,"
I prove through the road and let the hustle speak.
In the skyline, my beat starts to breathe.
Hold me close as the studio turns and the moment speak.
In the studio, my bars starts to breathe.
Hold me close as the concrete turns and the story grind.
Hold me close as the concrete turns and the crew write.
I flip through the night and let the crew speak.
In the block, my bars starts to grind."
hiphop,hiphop.00085.wav,Welcome To The Terrordome,Public Enemy,"
A broken dream keeps time with the concrete.
A bright story keeps time with the skyline.
Hold me close as the baseline turns and the beat flip.
No more dream, just heavy beat in the room.
Hold me close as the block turns and the truth speak.
Tonight we flip, tomorrow we write, but the story stays.
Hold me close as the baseline turns and the bars rise.
I rise through the night and let the hustle speak."
hiphop,hiphop.00086.wav,Pollywanacraka,Public Enemy,"
In the studio, my dream starts to write.
Tonight we grind, tomorrow we grind, but the crew stays.
No more story, just wild crew in the night.
No more moment, just lonely beat in the river.
No more story, just soft beat in the night.
I write through the sun and let the bars speak.
In the concrete, my truth starts to write.
I speak through the sun and let the moment speak."
hiphop,hiphop.00087.wav,Anti-Nigger Machine,Public Enemy,"
In the streetlight, my dream starts to grind.
A golden crew keeps time with the streetlight.
Hold me close as the block turns and the dream build.
A restless crew keeps time with the block.
Hold me close as the headphones turns and the story build.
Tonight we build, tomorrow we grind, but the crew stays.
No more beat, just soft story in the street.
In the subway, my dream starts to grind."
hiphop,hiphop.00088.wav,Burn Hollywood Burn,Public Enemy,"
No more bars, just bright truth in the sky.
No more dream, just soft moment in the road.
No more dream, just bright story in the river.
I build through the night and let the truth speak.
Hold me close as the block turns and the dream write.
A golden story keeps time with the headphones.
Hold me close as the skyline turns and the beat prove.
A soft bars keeps time with the studio."
hiphop,hiphop.00089.wav,Power To The People,Public Enemy,"
In the subway, my moment starts to breathe.
In the streetlight, my bars starts to breathe.
A quiet bars keeps time with the studio.
Tonight we breathe, tomorrow we build, but the dream stays.
I breathe through the sky and let the moment speak.
In the skyline, my hustle starts to prove.
No more truth, just restless truth in the room.
Hold me close as the studio turns and the dream prove."
hiphop,hiphop.00090.wav,Who Stole the Soul,Public Enemy,"
Hold me close as the studio turns and the dream speak.
A lonely crew keeps time with the headphones.
Hold me close as the baseline turns and the crew write.
Hold me close as the subway turns and the bars grind.
I breathe through the sun and let the hustle speak.
Tonight we build, tomorrow we write, but the crew stays.
No more truth, just bright crew in the road.
A soft hustle keeps time with the concrete."
hiphop,hiphop.00091.wav,Fear of a Black Planet,Public Enemy,"
Tonight we breathe, tomorrow we breathe, but the beat stays.
Hold me close as the streetlight turns and the crew prove.
In the block, my dream starts to speak.
No more crew, just heavy dream in the room.
Tonight we breathe, tomorrow we write, but the truth stays.
A golden bars keeps time with the studio.
Tonight we write, tomorrow we write, but the beat stays.
I grind through the sky and let the dream speak."
hiphop,hiphop.00092.wav,Revolutionary Generation,Public Enemy,"
A broken moment keeps time with the studio.
No more dream, just restless dream in the road.
Hold me close as the subway turns and the moment build.
Tonight we write, tomorrow we write, but the bars stays.
In the skyline, my truth starts to build.
No more truth, just heavy truth in the sky.
Hold me close as the skyline turns and the moment breathe.
No more moment, just heavy beat in the road."
hiphop,hiphop.00093.wav,"Can't Do Nuttin' For Ya, Man!",Public Enemy,"
No more crew, just restless story in the street.
Tonight we build, tomorrow we build, but the story stays.
Hold me close as the skyline turns and the truth grind.
A restless moment keeps time with the concrete.
No more truth, just heavy beat in the room.
No more hustle, just bright hustle in the sky.
I breathe through the river and let the story speak.
In the concrete, my beat starts to rise."
hiphop,hiphop.00094.wav,Reggie Jax,Public Enemy,"
I flip through the night and let the bars speak.
I write through the street and let the bars speak.
I build through the rain and let the beat speak.
I speak through the night and let the hustle speak.
In the headphones, my truth starts to grind.
Tonight we grind, tomorrow we write, but the crew stays.
Hold me close as the skyline turns and the hustle grind.
Tonight we grind, tomorrow we write, but the hustle stays."
hiphop,hiphop.00095.wav,Leave This off Your Fu*kin Charts,Public Enemy,"
A broken bars keeps time with the skyline.
No more dream, just bright story in the road.
No more crew, just soft beat in the rain.
In the block, my beat starts to flip.
No more hustle, just broken bars in the sky.
No more truth, just electric crew in the sun.
In the studio, my crew starts to flip.
In the streetlight, my truth starts to prove."
hiphop,hiphop.00096.wav,B Side Wins Again,Public Enemy,"
I grind through the night and let the moment speak.
Hold me close as the studio turns and the hustle build.
I write through the sun and let the bars speak.
Hold me close as the studio turns and the truth breathe.
I grind through the street and let the crew speak.
I grind through the river and let the bars speak.
In the subway, my truth starts to prove.
In the baseline, my moment starts to build."
hiphop,hiphop.00097.wav,War At 33 1/3,Public Enemy,"
In the baseline, my beat starts to flip.
In the headphones, my moment starts to grind.
Hold me close as the studio turns and the bars flip.
No more dream, just soft story in the sun.
Hold me close as the block turns and the hustle prove.
In the studio, my dream starts to grind.
No more dream, just wild bars in the night.
Tonight we grind, tomorrow we prove, but the story stays."
hiphop,hiphop.00098.wav,Fight the Power,Public Enemy,"
Tonight we prove, tomorrow we write, but the hustle stays.
In the subway, my crew starts to rise.
Tonight we rise, tomorrow we grind, but the bars stays.
No more hustle, just bright crew in the room.
I rise through the rain and let the bars speak.
No more beat, just restless crew in the street.
Tonight we breathe, tomorrow we speak, but the story stays.
In the studio, my hustle starts to write."
hiphop,hiphop.00099.wav,Let's Stay Together (Together Forever),RUN-DMC,"
Hold me close as the streetlight turns and the bars write.
Hold me close as the subway turns and the dream speak.
A lonely hustle keeps time with the headphones.
Hold me close as the streetlight turns and the hustle flip.
No more crew, just lonely truth in the sky.
In the block, my hustle starts to breathe.
Hold me close as the studio turns and the truth speak.
No more dream, just heavy bars in the room."
jazz,jazz.00000.wav,"On the Town: Three Dance Episodes, The great lover",Leonard Bernstein,"
I slide through the sky and let the glass speak.
In the brass, my glass starts to wander.
A quiet laugh keeps time with the sidewalk.
Hold me close as the improv turns and the laugh riff.
Hold me close as the afterglow turns and the night curl.
Hold me close as the improv turns and the melody curl.
No more trumpet, just lonely sax in the window.
Tonight we riff, tomorrow we spark, but the glass stays."
jazz,jazz.00001.wav,"Symphonic dances from West Side Story, Prologue",Leonard Bernstein,"
A wild sax keeps time with the late club.
In the late club, my melody starts to slide.
No more glass, just quiet glass in the street.
A restless chord keeps time with the afterglow.
I swing through the river and let the night speak.
A restless glass keeps time with the sidewalk.
I wander through the road and let the night speak.
In the improv, my glass starts to wander."
jazz,jazz.00002.wav,Round Midnight,James Carter,"
A bright heartbeat keeps time with the smoke.
In the blue hour, my sax starts to wander.
A lonely laugh keeps time with the afterglow.
Hold me close as the blue hour turns and the night curl.
In the sidewalk, my glass starts to swing.
A bright laugh keeps time with the smoke.
Tonight we curl, tomorrow we spark, but the trumpet stays.
No more night, just lonely glass in the room."
jazz,jazz.00003.wav,You Never Told Me That You Care,James Carter,"
No more sax, just golden laugh in the road.
A soft glass keeps time with the blue hour.
I curl through the night and let the glass speak.
I stroll through the rain and let the laugh speak.
Hold me close as the afterglow turns and the melody wander.
Hold me close as the brass turns and the sax spark.
In the afterglow, my glass starts to wander.
A golden laugh keeps time with the afterglow."
jazz,jazz.00004.wav,The Intimacy Of My Woman's Beautiful Eyes,James Carter,"
Hold me close as the sidewalk turns and the glass swing.
In the afterglow, my night starts to slide.
A broken glass keeps time with the improv.
No more glass, just quiet chord in the sky.
No more chord, just quiet chord in the room.
Hold me close as the brass turns and the glass stroll.
Tonight we stroll, tomorrow we swing, but the laugh stays.
Hold me close as the improv turns and the night swing."
jazz,jazz.00005.wav,1944 Stomp,James Carter,"
Hold me close as the blue hour turns and the trumpet riff.
In the improv, my laugh starts to swing.
I flow through the rain and let the glass speak.
Hold me close as the sidewalk turns and the chord flow.
Hold me close as the improv turns and the laugh swing.
In the sidewalk, my heartbeat starts to wander.
I stroll through the corner and let the night speak.
No more night, just electric night in the window."
jazz,jazz.00006.wav,The Stevedore's Serenade,James Carter,"
In the improv, my chord starts to flow.
Tonight we flow, tomorrow we spark, but the heartbeat stays.
Hold me close as the sidewalk turns and the chord swing.
In the brass, my heartbeat starts to curl.
I wander through the sun and let the sax speak.
I spark through the window and let the night speak.
Tonight we stroll, tomorrow we curl, but the trumpet stays.
No more heartbeat, just lonely chord in the window."
jazz,jazz.00007.wav,Born To Be Blue,James Carter,"
Tonight we swing, tomorrow we swing, but the chord stays.
In the afterglow, my sax starts to flow.
Tonight we slide, tomorrow we spark, but the sax stays.
Tonight we stroll, tomorrow we flow, but the laugh stays.
No more heartbeat, just restless heartbeat in the street.
A restless glass keeps time with the afterglow.
In the sidewalk, my trumpet starts to flow.
No more night, just bright sax in the room."
jazz,jazz.00008.wav,Deep Throat Blues,James Carter,"
Tonight we flow, tomorrow we stroll, but the chord stays.
In the smoke, my laugh starts to curl.
Tonight we wander, tomorrow we wander, but the melody stays.
A soft melody keeps time with the sidewalk.
No more heartbeat, just golden melody in the corner.
No more sax, just lonely sax in the rain.
In the brass, my night starts to curl.
Hold me close as the corner stage turns and the night curl."
jazz,jazz.00009.wav,A Ballad For A Doll,James Carter,"
Hold me close as the sidewalk turns and the sax wander.
I spark through the corner and let the trumpet speak.
Hold me close as the late club turns and the chord spark.
A heavy trumpet keeps time with the sidewalk.
In the improv, my night starts to swing.
Hold me close as the corner stage turns and the laugh flow.
Hold me close as the sidewalk turns and the glass swing.
Hold me close as the afterglow turns and the night stroll."
jazz,jazz.00010.wav,Eventide,James Carter,"
I wander through the river and let the trumpet speak.
No more trumpet, just lonely sax in the window.
I riff through the night and let the chord speak.
Hold me close as the brass turns and the melody curl.
No more glass, just broken glass in the sun.
Hold me close as the brass turns and the melody slide.
In the late club, my night starts to slide.
No more melody, just broken night in the night."
jazz,jazz.00011.wav,Lonnie's Lament,Joe Lovano,"
I stroll through the sky and let the sax speak.
In the late club, my chord starts to swing.
Hold me close as the sidewalk turns and the sax wander.
Tonight we flow, tomorrow we stroll, but the laugh stays.
In the sidewalk, my night starts to stroll.
No more chord, just bright chord in the street.
Hold me close as the sidewalk turns and the chord curl.
Hold me close as the blue hour turns and the trumpet riff."
jazz,jazz.00012.wav,Reflections,Joe Lovano,"
A restless heartbeat keeps time with the blue hour.
No more laugh, just electric sax in the street.
Hold me close as the blue hour turns and the laugh flow.
Tonight we curl, tomorrow we riff, but the heartbeat stays.
A soft glass keeps time with the smoke.
No more sax, just heavy melody in the night.
In the afterglow, my chord starts to swing.
Hold me close as the blue hour turns and the chord flow."
jazz,jazz.00013.wav,Little Willie Leaps,Joe Lovano,"
No more heartbeat, just electric sax in the window.
Hold me close as the sidewalk turns and the sax slide.
I riff through the sky and let the sax speak.
Tonight we wander, tomorrow we spark, but the melody stays.
In the sidewalk, my heartbeat starts to wander.
I stroll through the room and let the laugh speak.
A wild night keeps time with the afterglow.
A wild night keeps time with the blue hour."
jazz,jazz.00014.wav,This Is All I Ask,Joe Lovano,"
A lonely sax keeps time with the smoke.
I wander through the river and let the melody speak.
Tonight we slide, tomorrow we flow, but the sax stays.
Tonight we riff, tomorrow we wander, but the sax stays.
Hold me close as the smoke turns and the laugh wander.
I curl through the street and let the glass speak.
In the blue hour, my glass starts to slide.
No more trumpet, just heavy laugh in the river."
jazz,jazz.00015.wav,26-2,Joe Lovano,"
Tonight we stroll, tomorrow we curl, but the sax stays.
Hold me close as the sidewalk turns and the night flow.
Tonight we swing, tomorrow we flow, but the sax stays.
A quiet melody keeps time with the blue hour.
No more melody, just broken laugh in the rain.
No more chord, just broken sax in the road.
No more heartbeat, just electric trumpet in the sun.
Tonight we riff, tomorrow we slide, but the heartbeat stays."
jazz,jazz.00016.wav,Duke Ellington's Sound Of Love,Joe Lovano,"
A restless melody keeps time with the blue hour.
No more trumpet, just soft chord in the street.
I riff through the room and let the laugh speak.
In the smoke, my trumpet starts to slide.
In the smoke, my melody starts to wander.
A broken trumpet keeps time with the afterglow.
No more chord, just bright night in the road.
Tonight we stroll, tomorrow we spark, but the sax stays."
jazz,jazz.00017.wav,Sounds Of Joy,Joe Lovano,"
No more night, just restless trumpet in the street.
A soft chord keeps time with the afterglow.
No more trumpet, just electric night in the sky.
A quiet heartbeat keeps time with the improv.
Hold me close as the sidewalk turns and the melody stroll.
Tonight we riff, tomorrow we wander, but the sax stays.
Tonight we stroll, tomorrow we spark, but the night stays.
Hold me close as the brass turns and the glass spark."
jazz,jazz.00018.wav,Fort Worth,Joe Lovano,"
In the afterglow, my trumpet starts to riff.
No more melody, just restless glass in the window.
Hold me close as the sidewalk turns and the trumpet curl.
Tonight we riff, tomorrow we flow, but the laugh stays.
I wander through the sun and let the melody speak.
In the improv, my chord starts to slide.
I slide through the rain and let the heartbeat speak.
I riff through the rain and let the trumpet speak."
jazz,jazz.00019.wav,Birds Of Springtimes Gone By,Joe Lovano,"
No more night, just restless heartbeat in the night.
I wander through the sky and let the heartbeat speak.
No more night, just wild chord in the sun.
In the smoke, my glass starts to curl.
In the smoke, my laugh starts to curl.
A golden heartbeat keeps time with the late club.
In the sidewalk, my heartbeat starts to slide.
I flow through the room and let the night speak."
jazz,jazz.00020.wav,I Can't Get Started,Joe Lovano,"
In the late club, my sax starts to flow.
I curl through the sky and let the sax speak.
A restless glass keeps time with the brass.
Hold me close as the improv turns and the glass swing.
In the afterglow, my glass starts to stroll.
In the corner stage, my glass starts to riff.
I swing through the sun and let the chord speak.
A heavy melody keeps time with the afterglow."
jazz,jazz.00021.wav,Uprising,Joe Lovano,"
Hold me close as the improv turns and the glass swing.
In the blue hour, my night starts to slide.
Tonight we swing, tomorrow we spark, but the heartbeat stays.
In the afterglow, my melody starts to flow.
No more sax, just golden laugh in the night.
In the improv, my heartbeat starts to swing.
Hold me close as the blue hour turns and the laugh wander.
No more chord, just wild melody in the rain."
jazz,jazz.00022.wav,Sail Away,Joe Lovano,"
Hold me close as the improv turns and the heartbeat swing.
A wild sax keeps time with the sidewalk.
Tonight we riff, tomorrow we riff, but the laugh stays.
I swing through the sky and let the laugh speak.
Tonight we slide, tomorrow we swing, but the melody stays.
I riff through the road and let the heartbeat speak.
In the sidewalk, my trumpet starts to swing.
No more trumpet, just electric night in the night."
jazz,jazz.00023.wav,Blues Not to Lose,Joe Lovano,"
Hold me close as the sidewalk turns and the heartbeat swing.
A bright sax keeps time with the blue hour.
I slide through the night and let the laugh speak.
In the late club, my chord starts to slide.
Hold me close as the sidewalk turns and the laugh stroll.
No more heartbeat, just restless glass in the room.
Hold me close as the improv turns and the chord curl.
No more trumpet, just broken glass in the room."
jazz,jazz.00024.wav,Song And Dance,Joe Lovano,"
A soft melody keeps time with the brass.
Tonight we wander, tomorrow we stroll, but the glass stays.
Hold me close as the sidewalk turns and the sax stroll.
No more night, just bright laugh in the road.
In the brass, my sax starts to curl.
Hold me close as the late club turns and the laugh wander.
Tonight we riff, tomorrow we flow, but the glass stays.
Tonight we stroll, tomorrow we flow, but the laugh stays."
jazz,jazz.00025.wav,Roused About,Branford Marsalis Trio,"
In the afterglow, my glass starts to stroll.
A golden chord keeps time with the blue hour.
Tonight we flow, tomorrow we wander, but the sax stays.
I curl through the window and let the trumpet speak.
I stroll through the corner and let the heartbeat speak.
Hold me close as the sidewalk turns and the heartbeat spark.
I slide through the rain and let the sax speak.
I spark through the street and let the night speak."
jazz,jazz.00026.wav,The Beautyful Ones Are Not Yet Born,Branford Marsalis Trio,"
Hold me close as the brass turns and the laugh riff.
Hold me close as the smoke turns and the chord wander.
Tonight we slide, tomorrow we curl, but the sax stays.
Tonight we flow, tomorrow we riff, but the trumpet stays.
In the brass, my heartbeat starts to swing.
A heavy glass keeps time with the improv.
In the afterglow, my melody starts to flow.
I spark through the rain and let the trumpet speak."
jazz,jazz.00027.wav,Xavier's Lair,Branford Marsalis Trio,"
No more trumpet, just broken laugh in the rain.
A quiet chord keeps time with the late club.
No more sax, just broken trumpet in the night.
Tonight we wander, tomorrow we curl, but the sax stays.
I swing through the street and let the chord speak.
Hold me close as the brass turns and the chord stroll.
No more trumpet, just quiet night in the street.
I swing through the road and let the night speak."
jazz,jazz.00028.wav,Cain & Abel,Branford Marsalis Trio,"
Tonight we spark, tomorrow we swing, but the sax stays.
I slide through the night and let the trumpet speak.
In the smoke, my trumpet starts to wander.
In the brass, my trumpet starts to slide.
Hold me close as the corner stage turns and the melody slide.
Hold me close as the corner stage turns and the heartbeat swing.
No more sax, just soft glass in the room.
A soft sax keeps time with the brass."
jazz,jazz.00029.wav,Citizen Tain,Branford Marsalis Trio,"
A quiet night keeps time with the blue hour.
Tonight we wander, tomorrow we curl, but the laugh stays.
No more trumpet, just golden glass in the river.
Hold me close as the late club turns and the melody flow.
In the sidewalk, my melody starts to spark.
Hold me close as the brass turns and the sax swing.
In the afterglow, my trumpet starts to slide.
Tonight we riff, tomorrow we wander, but the sax stays."
jazz,jazz.00030.wav,Gilligan's Isle,Branford Marsalis Trio,"
Tonight we stroll, tomorrow we stroll, but the chord stays.
In the sidewalk, my trumpet starts to slide.
Tonight we riff, tomorrow we spark, but the trumpet stays.
Tonight we curl, tomorrow we riff, but the night stays.
Tonight we slide, tomorrow we flow, but the melody stays.
In the blue hour, my trumpet starts to curl.
No more laugh, just electric laugh in the corner.
I swing through the room and let the glass speak."
jazz,jazz.00031.wav,Dewey Baby,Branford Marsalis Trio,"
Hold me close as the sidewalk turns and the glass slide.
Tonight we slide, tomorrow we curl, but the chord stays.
I stroll through the night and let the night speak.
No more heartbeat, just electric laugh in the river.
Tonight we slide, tomorrow we wander, but the laugh stays.
In the improv, my glass starts to slide.
No more trumpet, just golden heartbeat in the sky.
Tonight we swing, tomorrow we curl, but the melody stays."
jazz,jazz.00032.wav,Beat's Remark,Branford Marsalis Trio,"
A electric chord keeps time with the improv.
A wild laugh keeps time with the sidewalk.
A lonely night keeps time with the blue hour.
A broken heartbeat keeps time with the late club.
In the afterglow, my laugh starts to wander.
In the afterglow, my trumpet starts to curl.
In the corner stage, my sax starts to curl.
No more melody, just lonely trumpet in the rain."
