genre,track,song name,artists,lyrics
blues,blues.00000.wav,"One Bourbon, One Scotch And One Beer",John Lee Hooker,"One bourbon, one scotch, and one beer
I say hey mister bartender come here
I want another drink and I want it now
My baby she gone, she been gone two night
I ain't seen my baby since night before last
I wanna get drunk and get her outta my mind
I want one bourbon, one scotch, and one beer
And then I sit down, drinkin', gettin' high, mellow, groving
I was getting stoned, and after a while
I looked on the wall, at the old clock on the wall
By that time, it was eleven thirty
Gettin' a little late
I looked down the bar, at the bartender, I say hey
What do you want
One bourbon, one scotch, and one beer
Well my baby she gone, she been gone two night
I ain't seen my baby since night before last
I wanna get drunk till I'm off of my mind
One bourbon, one scotch, and one beer
And I sat there again,
I was drinkin, ' gettin', stoned
And doopin', doopin'
Getting busy with the hand
And after a while
I looked on the wall again
And by that time, last call for alchohol
Then I looked down at the bar, at the bartender
I said hey mister bartender, what do you want this time
One bourbon, one scotch, and one beer"
blues,blues.00001.wav,I'm In The Mood For Love,John Lee Hooker,"I'm in the mood, I'm in the mood for love
In the town I see you, baby
Walking down the street
You know I get a thrill
Now baby, pull my head down through my toes
I'm in the mood
I'm in the mood, I'm in the mood for love
Nighttime is the right time, to be with the one you love
You know when night come baby, God know, you're so far away
I'm in the mood
I'm in the mood, I'm in the mood for love
I'm in the mood baby, yes I'm in the mood
If I can't be with you baby, I won't
Be with nobody ever
I can't get my feel now baby, nothing of being with you
I'm in the mood
I'm in the mood, I'm in the mood for love
I'm in the mood baby, yes I'm in the mood
Yes my mama told me to leave that girl alone
But my mama didn't know, God know, girl was puttin' down
I'm in the mood
I'm in the mood, I'm in the mood for love
I'm in the mood, I'm in the mood, baby, I'm in the mood"
blues,blues.00002.wav,Think Twice Before You Go,John Lee Hooker,"Think twice before you go, baby, this will be the end
Think twice before you go, baby, this will be the end
You done leave me one time, baby you'll leave me again
Dig in and suffer with me, then I know you paid your dues
Dig in and suffer with me baby, then I know you paid your dues
You done leave me when I need you, then I know you stand accused"
blues,blues.00003.wav,I'm Bad Like Jesse James,John Lee Hooker,"Little thing I'm going to do
Called ""I'm Bad Like Jesse James""
I'm bad
I'm bad
Like Jesse James, uh-huh
I had a friend one time
Least I thought I did
He come to me
Said, ""Johnny""
Said, ""What man?""
""I'm outdoor""
I say, ""Yeah?""
I taken the cat in
Get him a place to stay
And I found out
He goin' 'round town
Tellin' ever'body that he
He got my wife
Then I gets mad, I goes to the cat
Like a good guy should
I said, ""Look, man
I'm gonna warn, you just one time
Next time I warn you
I might use my gun"""
blues,blues.00004.wav,Walkin' the Boogie,John Lee Hooker,"Well my mama she didn't 'low me, just to stay out all night long, oh Lord
Well my mama didn't 'low me, just to stay out all night long
I didn't care what she didn't 'low, I would
Boogie-woogie
Anyhow
When I first came to town people, I was walkin' down Hastings Street
Everybody was talkin' about, the Henry Swing Club
I decided I drop in there that night
When I got there, I say, ""Yes, people""
They was really havin' a ball!
Yes, I know
Boogie Chillun
One night I was layin' down
I heard mama 'n papa talkin'
I heard papa tell mama, let that boy boogie-woogie
It's in him, and it got to come out
And I felt so good
Went on boogie'n just the same"
blues,blues.00005.wav,Sugar Mama,John Lee Hooker,"Sugar mama, sugar mama, sugar mama please come back to me
Sugar mama, sugar mama, sugar mama please come back to me
Bring me my granulated sugar, sugar mama, sugar mama ease my misery
You've got this new grade of sugar, sugar mama, an you done made me love it too
You've got this new grade of sugar, sugar mama, an you done made me love it too
You've got this granulated sugar, sugar mama, ain't nobody else got, but you
They been braggin' 'bout your sugar, sugar mama, been braggin' all over town
They been braggin' 'bout your sugar, sugar mama, braggin' all over town
Everywhere i go sugar mama, sugar mama you can hear your name
Read them crazy about you sugar mama
Because you ease my worried mind
Read them crazy about you sugar mama
Because you ease my worried mind
You got something something sugar mama
Ain't nobody else got but you
Now, the bootleggers want you to sell 'em enough to make whiskey
But you won't sell 'em about four or five pounds
I like my coffee sweet early in the mornin', you know, an I'm crazy 'bout my tea at night
You what i meant about that sugar mama
I like my coffee sweet early in the mornin', you know, an I'm crazy 'bout my tea at night
Don't get my sugar three times a day, oh, Lord
You don't mean you just can't get along right
Then I don't feel right"
blues,blues.00006.wav,Dreamin' Blues,John Lee Hooker,"My baby left me this morning
People just around four o'clock
My baby left me this morning
People just around four o'clock
She left me dreamin' dreamin'
People then I woke up crying
Me and my baby don't get along so well
We don't do a doggone thing but fuss and fight all
Most all the time, she left me to dream
People dream most all the time
Ever since my baby left me
I don't do a doggone thing but dream
Yes my nightmares are killing me now
You know I lay down dreamin'
People God knows that I wake up crying
Yes since my baby's been gone
People I just can't eat a bite
I'm gonna get up in the morning
Going down that lonesome road
I don't find my baby
People I won't be back no more"
blues,blues.00007.wav,Ground Hog Blues,John Lee Hooker,"It's a low-down dog, a dirty Groundhog that rootin' round my in back door
Yes if I catch him there rootin' there [man?], Lord, he won't root there no more
Yes he stand and he watch me, in the morning when I leave home
Yes he stand and he watch me, Lord, in the morning when I leave home
Then when I leave home in the morning, yes, he hangs around all day long
Give me some toads'n' frogs' hips
I'm gonna, gonna, put it all together
I'm gonna, gonna mix it up together
I'm gonna, gonna whup it all up good
I'm gonna, gonna kill that ol' dirty Groundhog
I bet'cha my bottom dollar then man, he, he won't root there no more
Na he ain't gonna root no more there
I said goodbye baby, Lord, I'm leavin' you now
I said goodbye baby, Lord, I'm leavin' you now
I done did what I want to done, killed that dirty ground hog"
blues,blues.00008.wav,Shake It Baby,John Lee Hooker,"Shake it baby
Shake it baby, one time for me
One time for me
Look baby, just smile
I don't care what your father say
I don't care what your mother say
As long as you love me, I love you
That's all that matters, baby
Shake it baby
Shake it baby
Shake it baby, for me, for me, one time
One time, for me
Come on here, come on here
Come on here, let go
You walk on the floor for me
Shake it baby, just for-, for me
Look baby
Waa-a-ah, shake it
Now baby, let's go
I don't care what your mother say
I don't care what your father say
As long as you love me, and I love you
Now come on, baby
One more time, just once more, one more
And one more, and one more!
And one more, and one more time!
And one more time, baby
Shake it baby
Shake it baby
Oh, yeah
Come on baby, just one more time
Look baby, look baby, just one more time
One more time baby
And one more, and one more!
And one more, and one more!
And one more time, baby!
And one more time, baby!
Shake it baby
Shake it baby
Shake it baby
Shake it baby
Shake it baby one more time
Alone baby
Alone baby
Alone baby
Alone baby
Alone baby"
blues,blues.00009.wav,It's My Own Fault,John Lee Hooker,"It's my own fault darlin', that you treat me the way you do
It's my own fault darlin', caused you treat me the way you do
When you left me darlin', I was callin' from town to town
Ooh, won't you give me one more chance
Ooh baby, won't you give me one more chance
Baby, I'll prove that I'm in love with you, you know I'll be travelin' no more
It's my own fault darlin', I made you treat me the way you do
It's my own fault darlin', I made you treat me the way you do
Baby I go alone, I just realized, all I did
Oh goodbye baby, I know we may never meet again
Oh goodbye baby, I know we may never meet again
But it's my own fault darlin', I made you treat me the way you did
See upcoming pop shows
Get tickets for your favorite artists
You might also like
Leave My Wife Alone
John Lee Hooker
Union Station Blues
John Lee Hooker
Boom Boom
John Lee Hooker"
blues,blues.00010.wav,Lonely Boy Boogie,John Lee Hooker,"Oh little girl, you look good to me
Hey little girl, you look good to me
I'm just a lonely boy baby, lookin' for someone to love
I went to San Antone, California too
When I got there baby, I feel a lonely boy
I didn't find nobody baby, even talk to me
That's why I'm asking you baby
Please be nice to me
'Cause I'm a lonely boy baby
Looking for someone to love
I walked into a tavern, had myself a seat
Everybody was so gay, having fun but me
When I sat down baby and looked into your face
The first thing I said little girl, you was the one for me
I said ohh, oh baby, I got eyes for you"
blues,blues.00011.wav,It Serves Me Right To Suffer,John Lee Hooker,"It serves you right to be alone
Because you're still livin'
The day done packed and gone
Every time you see a woman
She makes you think of yours
Every time you see a woman
She makes you think of yours
And that's why, that's why, that's why
You can't, keep from crying
Your doctor put you on
Milk, cream, and alcohol
Your doctor put you on
Milk, cream, and alcohol"
blues,blues.00012.wav,Cross Road Blues,Robert Johnson,"I went to the crossroad, fell down on my knees
I went to the crossroad, fell down on my knees
Asked the Lord above, ""Have mercy, now, save poor Bob if you please""
Yeah, standin' at the crossroad, tried to flag a ride
Ooh-ee, I tried to flag a ride
Didn't nobody seem to know me, babe, everybody pass me by
Standin' at the crossroad, baby, risin' sun goin' down
Standin' at the crossroad, baby, risin' sun goin' down
I believe to my soul, now, poor Bob is sinkin' down
You can run, you can run, tell my friend Willie Brown
You can run, you can run, tell my friend Willie Brown
That I got the crossroad blues this mornin', Lord, baby, I'm sinkin' down
And I went to the crossroad, mama, I looked East and West
I went to the crossroad, baby, I looked East and West
Lord, I didn't have no sweet woman, ooh well, babe, in my distress"
blues,blues.00013.wav,Terraplane Blues,Robert Johnson,"And I feel so lonesome, you hear me when I moan
Who been drivin' my Terraplane for you since I been gone?
I'd said I flash your lights, mama, you horn won't even blow
Somebody's been runnin' my batteries down on this machine
I even flash my lights, mama, this horn won't even blow
Got a short in this connection, hoo well, babe, it's way down below
I'm goin' heist your hood, mama, I'm bound to check your oil
I'm goin' heist your hood, mama, mmm, I'm bound to check your oil
I got a woman that I'm lovin', way down in Arkansas"
blues,blues.00014.wav,Come On In My Kitchen,Robert Johnson,"You better come on in my kitchen
Well, it's goin' to be rainin' outdoors
Ah, the woman I love, took from my best friend
Some joker got lucky, stole her back again
You better come on in my kitchen
It's goin' to be rainin' outdoors
Oh, she's gone, I know she won't come back
I've taken the last nickel out of her nation sack
You better come on in my kitchen
It's goin' to be rainin' outdoors
Oh, can't you hear that wind howl?
Oh, can't you hear that wind would howl?
You better come on in my kitchen
Well, it's goin' to be rainin' outdoors"
blues,blues.00015.wav,Walking blues,Robert Johnson,"I woke up this mornin', feelin' round for my shoes
Know 'bout 'at I got these, old walkin' blues
Woke up this mornin', feelin' round for my shoes
But you know 'bout 'at I, got these old walkin' blues
Lord, I feel like blowin' my old lonesome horn
Got up this mornin', my little Bernice was gone
Lord, I feel like blowin' my lonesome horn
Well I got up this mornin' all I had was gone
Well leave this morn' of I have to ride the blind
I've feel mistreated and I don't mind dyin'
Leavin' this morn', I have to ride a blind
Babe, I been mistreated, baby, and I don't mind dyin'"
blues,blues.00016.wav,Last Fair Deal Gone Down,Robert Johnson,"It's the last fair deal gone down,
Last fair deal gone down,
It's the last fair deal gone down, good lord,
On that gulfport island road.
Ida belle don't cry this time,
Ida belle don't cry this time,
If you cry 'bout a nickel, you die 'bout a dime,
She wouldn't cry, but the money won't mine.
I love the way you do,
I love the way you do,
I love the way you do, good lord,
On this gulfport island road."
blues,blues.00017.wav,32-20 Blues,Robert Johnson,"F I send for my baby, man, and she don't come
All the doctors in Hot Springs sure can't help her none
And if she gets unruly, thinks she don't wan' do
And if she gets unruly and thinks she don't wan' do
Take my .32-20, now, and cut her half in two
She got a .38 special but I believe it's most too light
She got a .38 special but I believe it's most too light
I got a .32-20, got to make the caps alright
If I send for my baby, man, and she don't come
If I send for my baby, man, and she don't come
All the doctors in Hot Springs sure can't help her none
I'm gonna shoot my pistol, gonna shoot my gatling gun
I'm gonna shoot my pistol, gotta shoot my gatling gun
You made me love you, now your man have come
Ahoh, baby, where you stayed last night
Ahah, baby, where you stayed last night
You got your hair all tangled and you ain't talking right
Her .38 special, boys, it do very well
Her .38 special, boys, it do very well
I got a .32-20 now, and it's a burning"
blues,blues.00018.wav,Kind Hearted Woman Blues,Robert Johnson,"I got a kindhearted woman, do anything in this world for me
But these evil-hearted women, man, they will not let me be
I love my baby, my baby don't love me
I love my baby, my baby don't love me
But I really love that woman, can't stand to leave her be
Ain't but the one thing, makes Mister Johnson drink
I's worried about how you treat me, baby, I begin to think
Oh, babe, my life don't feel the same
You breaks my heart, when you call Mister So-and-So's name
She's a kindhearted woman, she studies evil all the time
She's a kindhearted woman, she studies evil all the time
You well's to kill me, as to have it on your mind"
blues,blues.00019.wav,If I Had Possession Over Judgement Day,Robert Johnson,"If I had possession, over judgment day
Lord, the little woman I'm lovin' wouldn't, have no right to pray
And I went to the mountain, lookin' as far as my eyes could see
And I went to the mountain, lookin' as far as my eyes would see
Some other man got my woman, and these lonesome blues got me
And I rolled and I tumbled and I, cried the whole night long
And I rolled and I tumbled and I, cried the whole night long
Boy, I woke up this mornin', my biscuit roller gone
Had to fold my arms and I, slowly walked away
(spoken: I didn't like the way she done)
Had to fold my arms and I, slowly walked away
I said in my mind, ""Yo' trouble gon' come some day one""
Now run here, baby, set down on my knee
Now run here, baby, set down on my knee
I wanna tell you all about the way they treated me"
blues,blues.00021.wav,When You Got A Good Friend,Robert Johnson,"When you got a good friend
That will stay right by your side
When you got a good friend
That will stay right by your side
Give her all of your spare time
Love and treat her right
I mistreated my baby
And I can't see no reason why
I mistreated my baby
But I can't see no reason why
Anytime I think about it
I just wring my hands and cry
Wonder, could I bear to apologize
Or would she sympathize with me?
Mmm, would she sympathize with me?
She's a brown skin woman
Just as sweet as a girlfriend can be"
blues,blues.00022.wav,Ramblin' On My Mind,Robert Johnson,"I got ramblin', I got ramblin' all on my mind
Hate to leave my baby, but you treat me so unkind
I got mean things, I got mean things all on my mind
Little girl, little girl, I got mean things all on my mind
Hate to leave you here, babe, but you treat me so unkind
Runnin' down to the station, catch the first mail train I see
(I think I hear her comin' now)
Runnin' down to the station, catch the old first mail train I see
I got the blues about Miss So-and-So, and the child got the blues about me
And I'm leavin' this mornin' with my arm fold' up and cryin'"
blues,blues.00023.wav,Stones In My Passway,Robert Johnson,"
In the midnight, my promise starts to stumble.
A lonely memory keeps time with the midnight.
A electric suitcase keeps time with the rain.
Hold me close as the rain turns and the guitar wander.
Hold me close as the whiskey turns and the heart moan.
No more shadow, just lonely guitar in the corner.
No more ticket, just restless memory in the river.
In the neon, my bruise starts to plead."
blues,blues.00024.wav,Traveling Riverside Blues,Robert Johnson,"
Hold me close as the whiskey turns and the guitar roll.
A soft suitcase keeps time with the midnight.
No more shadow, just heavy promise in the rain.
In the road, my shadow starts to moan.
No more promise, just electric bruise in the street.
No more heart, just quiet shadow in the road.
In the river, my ticket starts to plead.
In the road, my promise starts to stumble."
blues,blues.00025.wav,Milkcow's Calf Blues,Robert Johnson,"
No more promise, just heavy shadow in the night.
I sigh through the night and let the promise speak.
Hold me close as the river turns and the memory sigh.
I ache through the room and let the guitar speak.
No more suitcase, just golden shadow in the room.
Hold me close as the river turns and the memory sigh.
A wild shadow keeps time with the smokestack.
A electric ticket keeps time with the neon."
blues,blues.00026.wav,Me And The Devil Blues,Robert Johnson,"
A lonely memory keeps time with the train.
Tonight we ache, tomorrow we moan, but the suitcase stays.
In the road, my guitar starts to plead.
I sigh through the room and let the suitcase speak.
Tonight we stumble, tomorrow we sigh, but the promise stays.
No more suitcase, just heavy promise in the corner.
In the train, my heart starts to drift.
A electric guitar keeps time with the midnight."
blues,blues.00027.wav,Hell Hound On My Trail,Robert Johnson,"
No more promise, just golden guitar in the sky.
Hold me close as the neon turns and the shadow roll.
A electric suitcase keeps time with the road.
A lonely memory keeps time with the rain.
A electric promise keeps time with the whiskey.
In the rain, my suitcase starts to roll.
A bright ticket keeps time with the train.
No more memory, just heavy promise in the rain."
blues,blues.00028.wav,Traveling Riverside Blues,Robert Johnson,"
No more promise, just bright memory in the night.
Hold me close as the river turns and the guitar plead.
No more suitcase, just golden guitar in the room.
A broken shadow keeps time with the river.
A restless heart keeps time with the whiskey.
A heavy memory keeps time with the midnight.
Hold me close as the road turns and the suitcase stumble.
I roll through the river and let the heart speak."
blues,blues.00029.wav,The House Carpenter,Kelly Joe Phelps,"
Hold me close as the midnight turns and the suitcase plead.
Hold me close as the smokestack turns and the promise drift.
Hold me close as the midnight turns and the promise stumble.
Tonight we roll, tomorrow we roll, but the guitar stays.
No more memory, just electric promise in the window.
No more heart, just bright promise in the window.
Hold me close as the whiskey turns and the suitcase drift.
Tonight we ache, tomorrow we sigh, but the bruise stays."
blues,blues.00030.wav,River Rat Jimmy,Kelly Joe Phelps,"
No more bruise, just wild guitar in the street.
A golden heart keeps time with the midnight.
In the train, my shadow starts to ache.
Hold me close as the road turns and the guitar plead.
I plead through the sun and let the ticket speak.
A bright shadow keeps time with the neon.
Tonight we stumble, tomorrow we ache, but the bruise stays.
I stumble through the sky and let the ticket speak."
blues,blues.00031.wav,Hobo's Son,Kelly Joe Phelps,"
Tonight we wander, tomorrow we drift, but the heart stays.
No more memory, just electric ticket in the night.
In the smokestack, my suitcase starts to moan.
In the road, my shadow starts to ache.
Hold me close as the whiskey turns and the bruise drift.
Tonight we ache, tomorrow we plead, but the memory stays.
A bright shadow keeps time with the smokestack.
In the smokestack, my heart starts to drift."
blues,blues.00032.wav,Katy,Kelly Joe Phelps,"
No more suitcase, just bright ticket in the corner.
I stumble through the rain and let the ticket speak.
I roll through the street and let the bruise speak.
Hold me close as the neon turns and the shadow plead.
Hold me close as the river turns and the ticket drift.
Tonight we drift, tomorrow we plead, but the shadow stays.
No more heart, just restless bruise in the sky.
I sigh through the night and let the bruise speak."
blues,blues.00033.wav,Wandering Away,Kelly Joe Phelps,"
No more suitcase, just quiet guitar in the river.
A golden promise keeps time with the rain.
Tonight we moan, tomorrow we sigh, but the memory stays.
Tonight we ache, tomorrow we roll, but the shadow stays.
I drift through the sky and let the shadow speak.
A electric memory keeps time with the rain.
Hold me close as the smokestack turns and the ticket roll.
In the whiskey, my bruise starts to wander."
blues,blues.00034.wav,Dock Boggs Country Blues,Kelly Joe Phelps,"
I moan through the road and let the memory speak.
In the road, my ticket starts to plead.
No more guitar, just restless ticket in the road.
No more heart, just broken suitcase in the window.
A soft heart keeps time with the river.
Hold me close as the river turns and the ticket wander.
In the midnight, my suitcase starts to stumble.
A quiet promise keeps time with the midnight."
blues,blues.00035.wav,Capman Bootman,Kelly Joe Phelps,"
Tonight we sigh, tomorrow we wander, but the promise stays.
I drift through the corner and let the memory speak.
Hold me close as the whiskey turns and the suitcase wander.
No more promise, just wild guitar in the corner.
In the train, my bruise starts to sigh.
In the midnight, my memory starts to wander.
A quiet bruise keeps time with the river.
Hold me close as the midnight turns and the suitcase stumble."
blues,blues.00036.wav,Train Carried My Girl From Town,Kelly Joe Phelps,"
Hold me close as the river turns and the guitar stumble.
Hold me close as the midnight turns and the promise roll.
Tonight we moan, tomorrow we roll, but the guitar stays.
I moan through the night and let the heart speak.
No more ticket, just golden bruise in the river.
Tonight we roll, tomorrow we stumble, but the memory stays.
I sigh through the sky and let the promise speak.
Hold me close as the road turns and the ticket roll."
blues,blues.00037.wav,Piece By Piece,Kelly Joe Phelps,"
Tonight we plead, tomorrow we ache, but the suitcase stays.
I drift through the corner and let the memory speak.
A lonely ticket keeps time with the rain.
No more bruise, just wild suitcase in the window.
I moan through the sun and let the memory speak.
Tonight we plead, tomorrow we ache, but the memory stays.
Tonight we plead, tomorrow we ache, but the ticket stays.
Tonight we wander, tomorrow we ache, but the promise stays."
blues,blues.00038.wav,Many A Time,Kelly Joe Phelps,"
Tonight we drift, tomorrow we sigh, but the ticket stays.
Tonight we sigh, tomorrow we ache, but the ticket stays.
No more heart, just golden suitcase in the night.
In the road, my ticket starts to wander.
No more suitcase, just broken promise in the night.
No more shadow, just restless memory in the road.
In the neon, my promise starts to ache.
Tonight we wander, tomorrow we sigh, but the memory stays."
blues,blues.00039.wav,Goodnight Irene,Kelly Joe Phelps,"
No more bruise, just wild ticket in the night.
I sigh through the window and let the heart speak.
In the midnight, my guitar starts to sigh.
A lonely heart keeps time with the rain.
A quiet ticket keeps time with the smokestack.
I roll through the street and let the memory speak.
Hold me close as the neon turns and the guitar drift.
In the midnight, my suitcase starts to stumble."
blues,blues.00040.wav,Love Struck Baby,Stevie Ray Vaughan,"
I drift through the room and let the promise speak.
Hold me close as the road turns and the suitcase roll.
In the neon, my ticket starts to moan.
I ache through the rain and let the heart speak.
Tonight we drift, tomorrow we ache, but the suitcase stays.
I sigh through the corner and let the bruise speak.
Tonight we stumble, tomorrow we roll, but the ticket stays.
No more shadow, just quiet suitcase in the sun."
blues,blues.00041.wav,Pride and Joy,Stevie Ray Vaughan,"
Tonight we ache, tomorrow we moan, but the ticket stays.
Tonight we ache, tomorrow we wander, but the memory stays.
I moan through the road and let the promise speak.
In the midnight, my guitar starts to moan.
A bright suitcase keeps time with the smokestack.
Hold me close as the smokestack turns and the guitar sigh.
Hold me close as the whiskey turns and the guitar roll.
I sigh through the street and let the bruise speak."
