genre,track,song name,artists,lyrics
pop,pop.00061.wav,Apple Pie a La Mode,Destiny's Child,"
In the city lights, my love starts to shine.
No more spark, just bright secret in the street.
I dream through the rain and let the photo speak.
No more photo, just golden kiss in the road.
Hold me close as the sunrise turns and the love dance.
In the sunrise, my kiss starts to dance.
Hold me close as the rooftop turns and the chorus run.
Hold me close as the summer turns and the message fall."
pop,pop.00062.wav,Survivor,Destiny's Child,"
A lonely photo keeps time with the late-night phone.
Tonight we run, tomorrow we shine, but the message stays.
No more love, just lonely love in the street.
In the mirror, my kiss starts to dream.
A heavy love keeps time with the summer.
A golden kiss keeps time with the city lights.
Hold me close as the city lights turns and the secret stay.
Tonight we breathe, tomorrow we stay, but the chorus stays."
pop,pop.00063.wav,Ain't No Mountain High Enough,Diana Ross,"
A broken wish keeps time with the playlist.
A broken secret keeps time with the summer.
In the summer, my spark starts to stay.
I shine through the corner and let the spark speak.
I dream through the street and let the message speak.
Hold me close as the playlist turns and the secret breathe.
A restless kiss keeps time with the mirror.
A heavy photo keeps time with the heartbeat."
pop,pop.00064.wav,If It Don't Fit (Thunderpuss 2000 Club Mix),Abigail,"
I dream through the street and let the chorus speak.
In the summer, my secret starts to fall.
I dream through the room and let the spark speak.
Hold me close as the late-night phone turns and the message glow.
Hold me close as the mirror turns and the wish run.
In the sunrise, my chorus starts to fall.
In the city lights, my chorus starts to dream.
No more photo, just restless kiss in the road."
pop,pop.00065.wav,The Beautiful Ones,Prince,"
Hold me close as the playlist turns and the love fall.
I dream through the river and let the love speak.
Tonight we run, tomorrow we fall, but the secret stays.
In the playlist, my kiss starts to glow.
I breathe through the river and let the wish speak.
No more secret, just electric secret in the window.
Hold me close as the sunrise turns and the photo fall.
A soft spark keeps time with the playlist."
pop,pop.00066.wav,Could I Have This Kiss Forever,Enrique Iglesias,"
In the heartbeat, my secret starts to dream.
Tonight we shine, tomorrow we stay, but the love stays.
I dance through the room and let the photo speak.
No more chorus, just electric photo in the road.
Hold me close as the summer turns and the love dance.
A bright kiss keeps time with the late-night phone.
No more photo, just broken kiss in the corner.
Tonight we run, tomorrow we dance, but the message stays."
pop,pop.00067.wav,All For You,Janet Jackson,"
In the city lights, my love starts to breathe.
Tonight we dance, tomorrow we run, but the wish stays.
Hold me close as the summer turns and the wish glow.
In the rooftop, my chorus starts to shine.
In the heartbeat, my wish starts to fall.
I fall through the night and let the kiss speak.
A quiet secret keeps time with the late-night phone.
I shine through the sun and let the wish speak."
pop,pop.00068.wav,Someone To Call My Lover,Janet Jackson,"
In the sunrise, my kiss starts to fall.
Tonight we glow, tomorrow we shine, but the photo stays.
Tonight we shine, tomorrow we breathe, but the kiss stays.
In the heartbeat, my message starts to glow.
Hold me close as the mirror turns and the message dream.
I run through the road and let the spark speak.
Tonight we run, tomorrow we glow, but the kiss stays.
In the city lights, my photo starts to run."
pop,pop.00069.wav,If,Janet Jackson,"
Tonight we run, tomorrow we fall, but the chorus stays.
Hold me close as the rooftop turns and the love shine.
Tonight we stay, tomorrow we fall, but the message stays.
Hold me close as the heartbeat turns and the chorus glow.
A broken kiss keeps time with the sunrise.
No more kiss, just soft secret in the night.
In the mirror, my spark starts to dance.
I dream through the street and let the kiss speak."
pop,pop.00070.wav,I Get Lonely,Janet Jackson,"
A broken chorus keeps time with the playlist.
In the rooftop, my message starts to stay.
Tonight we stay, tomorrow we fall, but the secret stays.
I glow through the window and let the message speak.
I dance through the window and let the kiss speak.
Tonight we breathe, tomorrow we run, but the message stays.
I dance through the river and let the message speak.
No more message, just lonely photo in the sun."
pop,pop.00071.wav,All For You,Janet Jackson,"
Hold me close as the summer turns and the chorus stay.
Hold me close as the playlist turns and the wish dream.
I dance through the sky and let the photo speak.
A golden love keeps time with the heartbeat.
In the sunrise, my kiss starts to stay.
I stay through the night and let the kiss speak.
No more photo, just heavy love in the river.
Tonight we fall, tomorrow we fall, but the spark stays."
pop,pop.00072.wav,Miss You Much,Janet Jackson,"
No more chorus, just quiet photo in the river.
No more spark, just bright kiss in the river.
In the late-night phone, my secret starts to dream.
Tonight we stay, tomorrow we fall, but the chorus stays.
I run through the room and let the message speak.
Tonight we stay, tomorrow we shine, but the spark stays.
A bright secret keeps time with the playlist.
A wild wish keeps time with the heartbeat."
pop,pop.00073.wav,Someone To Call My Lover,Janet Jackson,"
In the sunrise, my chorus starts to breathe.
I dream through the street and let the secret speak.
A bright message keeps time with the sunrise.
Hold me close as the summer turns and the photo stay.
In the heartbeat, my kiss starts to breathe.
In the sunrise, my kiss starts to stay.
No more chorus, just restless message in the corner.
Tonight we shine, tomorrow we stay, but the photo stays."
pop,pop.00074.wav,I'm Real (Murder Remix),Jennifer Lopez; Ja Rule,"
Hold me close as the mirror turns and the wish run.
No more love, just wild message in the sky.
A golden secret keeps time with the sunrise.
No more spark, just heavy spark in the sky.
No more love, just golden chorus in the sky.
No more love, just restless chorus in the river.
Tonight we run, tomorrow we fall, but the chorus stays.
Tonight we dream, tomorrow we glow, but the kiss stays."
pop,pop.00075.wav,If You Had My Love,Jennifer Lopez,"
A broken chorus keeps time with the sunrise.
Tonight we dream, tomorrow we dream, but the kiss stays.
A broken secret keeps time with the late-night phone.
In the summer, my secret starts to run.
In the heartbeat, my love starts to run.
I glow through the river and let the photo speak.
In the late-night phone, my kiss starts to fall.
In the mirror, my wish starts to glow."
pop,pop.00076.wav,Dance With Me,Jennifer Lopez,"
I dance through the night and let the love speak.
Tonight we breathe, tomorrow we dream, but the secret stays.
I fall through the window and let the secret speak.
No more wish, just broken message in the corner.
No more spark, just wild spark in the sky.
In the sunrise, my spark starts to run.
No more photo, just restless secret in the street.
In the heartbeat, my photo starts to breathe."
pop,pop.00077.wav,I'm Real,Jennifer Lopez,"
A heavy wish keeps time with the heartbeat.
No more message, just heavy love in the river.
Tonight we stay, tomorrow we shine, but the message stays.
I breathe through the rain and let the secret speak.
A soft message keeps time with the summer.
In the playlist, my wish starts to run.
Tonight we shine, tomorrow we stay, but the love stays.
A quiet kiss keeps time with the summer."
pop,pop.00078.wav,Play,Jennifer Lopez,"
Tonight we dream, tomorrow we dream, but the photo stays.
Tonight we run, tomorrow we dream, but the wish stays.
In the summer, my chorus starts to shine.
No more secret, just golden message in the corner.
I glow through the river and let the spark speak.
Hold me close as the late-night phone turns and the love dream.
No more spark, just heavy love in the night.
I fall through the corner and let the spark speak."
pop,pop.00079.wav,Couldbusting,Kate Bush,"
In the playlist, my wish starts to breathe.
No more spark, just quiet love in the road.
I run through the river and let the kiss speak.
Tonight we stay, tomorrow we dance, but the chorus stays.
In the playlist, my secret starts to run.
I glow through the room and let the secret speak.
Tonight we dance, tomorrow we run, but the secret stays.
Hold me close as the mirror turns and the photo breathe."
pop,pop.00080.wav,Lady Marmalade,Christina Aguilera,"
In the late-night phone, my chorus starts to fall.
In the summer, my spark starts to breathe.
A quiet love keeps time with the sunrise.
In the playlist, my wish starts to stay.
A quiet secret keeps time with the sunrise.
In the sunrise, my love starts to dream.
Hold me close as the mirror turns and the spark glow.
I breathe through the sky and let the spark speak."
pop,pop.00081.wav,Leaning On The Everlasting Arm,Ladysmith Black Mambazo,"
A soft photo keeps time with the late-night phone.
Tonight we breathe, tomorrow we dream, but the chorus stays.
A electric photo keeps time with the summer.
Hold me close as the mirror turns and the wish shine.
A wild message keeps time with the summer.
No more message, just soft love in the sky.
I shine through the corner and let the wish speak.
No more spark, just soft message in the road."
pop,pop.00082.wav,If You Had My Love (Pablo Flores Remix),Jennifer Lopez,"
Tonight we dance, tomorrow we glow, but the love stays.
Hold me close as the sunrise turns and the chorus fall.
A quiet kiss keeps time with the summer.
A lonely spark keeps time with the heartbeat.
Tonight we fall, tomorrow we fall, but the photo stays.
A wild kiss keeps time with the sunrise.
Tonight we stay, tomorrow we run, but the wish stays.
A electric kiss keeps time with the heartbeat."
pop,pop.00083.wav,American Pie,Madonna,"
Hold me close as the late-night phone turns and the kiss glow.
In the playlist, my chorus starts to fall.
Tonight we fall, tomorrow we fall, but the spark stays.
In the city lights, my message starts to fall.
Hold me close as the summer turns and the spark breathe.
No more love, just soft love in the room.
A heavy kiss keeps time with the late-night phone.
Tonight we dance, tomorrow we glow, but the spark stays."
pop,pop.00084.wav,Don't Tell Me,Madonna,"
Hold me close as the summer turns and the chorus breathe.
A wild secret keeps time with the rooftop.
I dream through the street and let the message speak.
A quiet secret keeps time with the late-night phone.
Hold me close as the sunrise turns and the wish breathe.
Hold me close as the summer turns and the spark run.
Hold me close as the city lights turns and the message stay.
Tonight we breathe, tomorrow we dance, but the spark stays."
pop,pop.00085.wav,Music,Madonna,"
No more message, just broken love in the river.
Tonight we run, tomorrow we dance, but the secret stays.
Tonight we dance, tomorrow we shine, but the message stays.
In the summer, my wish starts to dream.
In the late-night phone, my spark starts to dance.
In the rooftop, my kiss starts to dream.
In the playlist, my kiss starts to glow.
In the rooftop, my love starts to run."
pop,pop.00086.wav,Cherish,Madonna,"
No more love, just quiet wish in the rain.
I dream through the corner and let the secret speak.
Tonight we fall, tomorrow we breathe, but the secret stays.
Hold me close as the city lights turns and the photo dream.
A soft secret keeps time with the late-night phone.
Tonight we shine, tomorrow we dance, but the love stays.
No more photo, just bright love in the corner.
In the rooftop, my spark starts to run."
pop,pop.00087.wav,Crush,Mandy Moore,"
I stay through the sky and let the secret speak.
Hold me close as the sunrise turns and the love dance.
I shine through the rain and let the wish speak.
No more love, just bright spark in the night.
Hold me close as the rooftop turns and the chorus run.
In the late-night phone, my spark starts to glow.
Hold me close as the playlist turns and the kiss shine.
I glow through the sky and let the secret speak."
pop,pop.00088.wav,Candy (Wade Robson Remix),Mandy Moore,"
A wild message keeps time with the heartbeat.
No more kiss, just soft message in the sky.
No more chorus, just bright message in the sky.
Hold me close as the summer turns and the message stay.
I breathe through the road and let the secret speak.
A golden kiss keeps time with the late-night phone.
A wild chorus keeps time with the heartbeat.
No more kiss, just lonely message in the sky."
pop,pop.00089.wav,Candy,Mandy Moore,"
Tonight we dream, tomorrow we breathe, but the message stays.
In the heartbeat, my photo starts to fall.
I dream through the sky and let the wish speak.
I stay through the rain and let the kiss speak.
I stay through the river and let the kiss speak.
Hold me close as the heartbeat turns and the message glow.
No more photo, just golden message in the river.
In the mirror, my photo starts to stay."
pop,pop.00090.wav,Crush,Mandy Moore,"
I glow through the sky and let the spark speak.
Hold me close as the summer turns and the message run.
Hold me close as the mirror turns and the secret shine.
Hold me close as the sunrise turns and the love dream.
I fall through the river and let the kiss speak.
I run through the corner and let the photo speak.
I breathe through the river and let the chorus speak.
I run through the river and let the wish speak."
pop,pop.00091.wav,Everything My Heart Desires,Mandy Moore,"
No more secret, just bright spark in the room.
In the mirror, my wish starts to glow.
I breathe through the sky and let the love speak.
No more chorus, just wild photo in the room.
Hold me close as the rooftop turns and the love stay.
No more love, just soft kiss in the river.
No more chorus, just lonely photo in the window.
In the city lights, my love starts to dream."
pop,pop.00092.wav,In My Pocket,Mandy Moore,"
I fall through the river and let the photo speak.
Tonight we dream, tomorrow we fall, but the wish stays.
A bright love keeps time with the heartbeat.
Hold me close as the heartbeat turns and the spark dream.
A heavy love keeps time with the sunrise.
In the city lights, my secret starts to dance.
A lonely kiss keeps time with the summer.
No more wish, just broken secret in the window."
pop,pop.00093.wav,I Wanna Be With You (Soul Solution Remix),Mandy Moore,"
I breathe through the road and let the love speak.
Hold me close as the city lights turns and the spark stay.
A golden secret keeps time with the mirror.
Tonight we breathe, tomorrow we stay, but the love stays.
A broken secret keeps time with the late-night phone.
I stay through the night and let the photo speak.
I breathe through the corner and let the chorus speak.
Hold me close as the heartbeat turns and the photo run."
pop,pop.00094.wav,I Wanna Be With You,Mandy Moore,"
Tonight we stay, tomorrow we dance, but the wish stays.
A electric kiss keeps time with the rooftop.
Hold me close as the heartbeat turns and the secret fall.
No more message, just lonely chorus in the window.
Tonight we fall, tomorrow we fall, but the kiss stays.
In the rooftop, my spark starts to stay.
A golden love keeps time with the city lights.
A soft kiss keeps time with the mirror."
pop,pop.00095.wav,Love You for Always,Mandy Moore,"
I fall through the street and let the kiss speak.
In the sunrise, my kiss starts to glow.
In the mirror, my secret starts to fall.
I stay through the street and let the secret speak.
Hold me close as the heartbeat turns and the wish breathe.
In the summer, my photo starts to shine.
No more secret, just wild secret in the river.
In the summer, my love starts to glow."
pop,pop.00096.wav,Quit Breaking My Heart,Mandy Moore,"
Hold me close as the summer turns and the wish breathe.
Tonight we fall, tomorrow we stay, but the spark stays.
A wild secret keeps time with the sunrise.
Tonight we stay, tomorrow we breathe, but the love stays.
A heavy kiss keeps time with the rooftop.
A golden message keeps time with the city lights.
No more kiss, just golden kiss in the road.
I dream through the window and let the secret speak."
pop,pop.00097.wav,Sweetheart,Mariah Carey,"
In the playlist, my photo starts to dream.
I shine through the road and let the spark speak.
I shine through the sky and let the photo speak.
In the playlist, my chorus starts to fall.
A golden wish keeps time with the sunrise.
I shine through the night and let the photo speak.
In the playlist, my message starts to fall.
I dance through the sun and let the secret speak."
pop,pop.00098.wav,Emotions,Mariah Carey,"
I stay through the sky and let the secret speak.
Tonight we run, tomorrow we run, but the spark stays.
Tonight we shine, tomorrow we run, but the wish stays.
I run through the window and let the kiss speak.
No more secret, just lonely kiss in the river.
Hold me close as the summer turns and the kiss dance.
No more secret, just soft message in the window.
Tonight we shine, tomorrow we stay, but the chorus stays."
pop,pop.00099.wav,Always Be My Baby,Mariah Carey,"
In the mirror, my secret starts to dance.
In the city lights, my wish starts to dance.
Hold me close as the heartbeat turns and the wish dream.
Tonight we breathe, tomorrow we run, but the photo stays.
Tonight we breathe, tomorrow we dance, but the kiss stays.
Hold me close as the summer turns and the photo dance.
Hold me close as the mirror turns and the chorus dream.
Tonight we stay, tomorrow we dance, but the spark stays."
reggae,reggae.00000.wav,Is This Love,Bob Marley,"
In the yard, my fire starts to smile.
A lonely wave keeps time with the morning.
Hold me close as the yard turns and the wave heal.
Tonight we rest, tomorrow we rest, but the home stays.
Tonight we float, tomorrow we float, but the home stays.
I rest through the sun and let the spirit speak.
I sing through the window and let the fire speak.
No more wave, just heavy peace in the window."
reggae,reggae.00001.wav,No Woman No Cry,Bob Marley,"
No more spirit, just golden home in the sun.
In the sand, my fire starts to rise.
Tonight we sing, tomorrow we smile, but the garden stays.
No more garden, just golden fire in the rain.
Tonight we rise, tomorrow we smile, but the wave stays.
I heal through the street and let the peace speak.
I heal through the window and let the fire speak.
No more garden, just wild wave in the sky."
reggae,reggae.00002.wav,Could You Be Loved,Bob Marley,"
I smile through the rain and let the home speak.
I rest through the road and let the fire speak.
Hold me close as the drum turns and the garden sway.
Tonight we sing, tomorrow we rest, but the peace stays.
No more peace, just quiet garden in the river.
A electric fire keeps time with the sand.
In the sun, my wave starts to smile.
In the yard, my rhythm starts to smile."
reggae,reggae.00003.wav,Three Little Birds,Bob Marley,"
In the drum, my garden starts to sway.
I rest through the sun and let the fire speak.
A heavy wave keeps time with the sea breeze.
I rise through the sky and let the peace speak.
A restless home keeps time with the roots.
In the yard, my home starts to smile.
Tonight we grow, tomorrow we rest, but the spirit stays.
I grow through the corner and let the rhythm speak."
reggae,reggae.00004.wav,Buffalo Soldier,Bob Marley,"
A restless rhythm keeps time with the island.
Tonight we heal, tomorrow we sway, but the home stays.
I smile through the room and let the spirit speak.
A lonely fire keeps time with the sand.
A quiet peace keeps time with the roots.
I sing through the rain and let the spirit speak.
No more wave, just heavy garden in the road.
No more spirit, just heavy wave in the road."
reggae,reggae.00005.wav,"Get Up, Stand Up",Bob Marley,"
In the roots, my rhythm starts to grow.
A lonely spirit keeps time with the sand.
Hold me close as the sand turns and the wave smile.
In the morning, my wave starts to rest.
Tonight we smile, tomorrow we sway, but the peace stays.
A soft heartbeat keeps time with the sea breeze.
A soft wave keeps time with the sand.
Hold me close as the sun turns and the rhythm float."
reggae,reggae.00006.wav,Stir it Up,Bob Marley,"
In the yard, my peace starts to sway.
No more home, just soft fire in the river.
No more heartbeat, just restless wave in the window.
I float through the street and let the rhythm speak.
In the sea breeze, my rhythm starts to smile.
I float through the corner and let the heartbeat speak.
No more wave, just golden home in the corner.
Tonight we heal, tomorrow we rest, but the fire stays."
reggae,reggae.00007.wav,One Love,Bob Marley,"
Hold me close as the island turns and the garden sing.
A wild fire keeps time with the sun.
I sing through the rain and let the home speak.
Tonight we rise, tomorrow we grow, but the rhythm stays.
I heal through the window and let the wave speak.
I rest through the night and let the peace speak.
A broken rhythm keeps time with the sun.
A broken garden keeps time with the morning."
reggae,reggae.00008.wav,I shot the Sheriff,Bob Marley,"
A wild home keeps time with the sun.
In the yard, my rhythm starts to sing.
In the morning, my garden starts to smile.
Hold me close as the morning turns and the home grow.
Tonight we rest, tomorrow we float, but the fire stays.
Tonight we grow, tomorrow we sing, but the rhythm stays.
No more wave, just electric fire in the road.
Tonight we rise, tomorrow we heal, but the home stays."
reggae,reggae.00009.wav,Waiting in vain,Bob Marley,"
Hold me close as the island turns and the fire float.
Hold me close as the sand turns and the fire smile.
Hold me close as the morning turns and the heartbeat sing.
No more heartbeat, just quiet rhythm in the street.
I float through the night and let the heartbeat speak.
I rise through the night and let the wave speak.
In the island, my fire starts to sway.
Hold me close as the drum turns and the rhythm smile."
reggae,reggae.00010.wav,Redemption Song,Bob Marley,"
I sing through the sky and let the rhythm speak.
Tonight we smile, tomorrow we sing, but the wave stays.
A quiet peace keeps time with the morning.
No more fire, just heavy rhythm in the room.
Tonight we rise, tomorrow we grow, but the spirit stays.
A bright garden keeps time with the morning.
A wild fire keeps time with the sea breeze.
A bright rhythm keeps time with the roots."
reggae,reggae.00011.wav,Satisfy My Soul,Bob Marley,"
In the sand, my wave starts to grow.
Hold me close as the yard turns and the spirit grow.
A electric spirit keeps time with the sand.
In the roots, my fire starts to rest.
Tonight we grow, tomorrow we rest, but the heartbeat stays.
In the yard, my peace starts to heal.
I sway through the night and let the home speak.
A bright home keeps time with the sun."
reggae,reggae.00012.wav,Exodus,Bob Marley,"
No more wave, just restless heartbeat in the room.
No more wave, just restless garden in the street.
Tonight we smile, tomorrow we sway, but the spirit stays.
Tonight we sway, tomorrow we float, but the wave stays.
Hold me close as the morning turns and the garden sing.
Hold me close as the drum turns and the garden rest.
I smile through the sun and let the spirit speak.
Hold me close as the roots turns and the home heal."
reggae,reggae.00013.wav,Jamming,Bob Marley,"
A quiet home keeps time with the sea breeze.
I heal through the street and let the garden speak.
No more peace, just broken home in the road.
Hold me close as the sun turns and the peace rise.
A wild wave keeps time with the sun.
In the sand, my home starts to sway.
In the roots, my garden starts to heal.
In the morning, my spirit starts to rise."
reggae,reggae.00014.wav,Natural Mystic,Bob Marley,"
Hold me close as the yard turns and the garden grow.
A heavy wave keeps time with the roots.
In the drum, my heartbeat starts to rise.
Tonight we heal, tomorrow we heal, but the peace stays.
Tonight we sway, tomorrow we sway, but the home stays.
No more fire, just lonely heartbeat in the window.
A heavy garden keeps time with the sea breeze.
In the yard, my rhythm starts to sway."
reggae,reggae.00015.wav,Easy Skanking,Bob Marley,"
I sway through the night and let the rhythm speak.
Hold me close as the island turns and the heartbeat smile.
A wild garden keeps time with the morning.
In the sand, my heartbeat starts to grow.
A soft heartbeat keeps time with the sun.
Hold me close as the drum turns and the fire heal.
A bright home keeps time with the sand.
Tonight we float, tomorrow we heal, but the heartbeat stays."
reggae,reggae.00016.wav,Iron Lion Zion,Bob Marley,"
A quiet heartbeat keeps time with the yard.
A electric spirit keeps time with the island.
Hold me close as the roots turns and the peace smile.
Hold me close as the sand turns and the spirit heal.
Tonight we rest, tomorrow we sing, but the garden stays.
I grow through the sun and let the heartbeat speak.
Hold me close as the yard turns and the heartbeat rise.
No more home, just wild home in the river."
reggae,reggae.00017.wav,Crazy Baldhead,Bob Marley,"
No more fire, just bright wave in the window.
No more spirit, just restless fire in the window.
In the roots, my fire starts to sing.
Tonight we sway, tomorrow we sing, but the fire stays.
A soft heartbeat keeps time with the drum.
Hold me close as the sun turns and the spirit heal.
In the drum, my heartbeat starts to rest.
Hold me close as the sea breeze turns and the home smile."
reggae,reggae.00018.wav,So Much Trouble In The World,Bob Marley,"
Hold me close as the sand turns and the garden sing.
Tonight we sway, tomorrow we rise, but the home stays.
Hold me close as the drum turns and the rhythm smile.
Hold me close as the island turns and the fire sway.
No more rhythm, just restless peace in the sun.
Hold me close as the sun turns and the home float.
Tonight we rise, tomorrow we sing, but the peace stays.
I float through the night and let the spirit speak."
