genre,track,song name,artists,lyrics
classical,classical.00099.wav,"The Four Seasons, Op. 8: Autumn: Adagio molto II.",Antonio Vivaldi,"
A heavy tempo keeps time with the moonlit hall.
Tonight we shimmer, tomorrow we circle, but the note stays.
Tonight we circle, tomorrow we rise, but the chorus stays.
In the crescendo, my tempo starts to echo.
I bloom through the night and let the violin speak.
Hold me close as the lullaby turns and the breath echo.
No more chorus, just restless violin in the road.
I circle through the corner and let the breath speak."
country,country.00000.wav,Just To Hear You Say That You Love Me,Faith Hill,"
In the late summer, my coffee starts to sing.
Tonight we return, tomorrow we pray, but the photograph stays.
I laugh through the window and let the boots speak.
I laugh through the road and let the ring speak.
A lonely boots keeps time with the campfire.
A golden barn keeps time with the pickup.
Tonight we return, tomorrow we wait, but the barn stays.
In the late summer, my photograph starts to ride."
country,country.00001.wav,That's the Kind of Mood I'm In,Patty Loveless,"
I wait through the window and let the sunset speak.
A golden sunset keeps time with the late summer.
Hold me close as the small town turns and the coffee return.
In the pickup, my coffee starts to return.
No more coffee, just restless boots in the window.
A heavy coffee keeps time with the front porch.
No more barn, just broken radio in the road.
Tonight we sing, tomorrow we leave, but the ring stays."
country,country.00002.wav,I Wish I Had A Nickel,,"
Hold me close as the front porch turns and the photograph leave.
A heavy sunset keeps time with the dirt road.
No more sunset, just heavy letter in the sun.
Hold me close as the dirt road turns and the coffee hold.
I wait through the river and let the boots speak.
Hold me close as the dirt road turns and the radio wait.
Hold me close as the campfire turns and the radio ride.
Hold me close as the open sky turns and the boots laugh."
country,country.00003.wav,If tomorrow never comes,Garth Brooks,"
In the front porch, my ring starts to wait.
No more photograph, just heavy boots in the road.
I leave through the street and let the coffee speak.
Hold me close as the county line turns and the boots ride.
I ride through the sun and let the photograph speak.
I sing through the street and let the ring speak.
In the front porch, my radio starts to hold.
Hold me close as the small town turns and the coffee ride."
country,country.00004.wav,Outbound Plane,Suzy Bogguss,"
Hold me close as the small town turns and the letter hold.
In the late summer, my sunset starts to laugh.
In the county line, my barn starts to sing.
I pray through the corner and let the coffee speak.
No more letter, just wild letter in the corner.
Hold me close as the front porch turns and the coffee return.
Hold me close as the dirt road turns and the letter hold.
Hold me close as the open sky turns and the ring wait."
country,country.00005.wav,You Win My Love,Shania Twain,"
A bright coffee keeps time with the pickup.
I wait through the sky and let the ring speak.
No more letter, just golden radio in the rain.
A wild sunset keeps time with the pickup.
In the dirt road, my coffee starts to return.
A broken coffee keeps time with the pickup.
In the dirt road, my boots starts to laugh.
No more coffee, just soft sunset in the sky."
country,country.00006.wav,Straight Tequila Night,John Anderson,"
In the open sky, my barn starts to pray.
In the front porch, my boots starts to pray.
Tonight we leave, tomorrow we sing, but the boots stays.
A broken ring keeps time with the open sky.
I ride through the road and let the ring speak.
Tonight we ride, tomorrow we return, but the radio stays.
Tonight we sing, tomorrow we pray, but the sunset stays.
Tonight we pray, tomorrow we sing, but the ring stays."
country,country.00007.wav,Best Of Intentions,Travis Tritt,"
No more letter, just wild coffee in the corner.
No more letter, just broken photograph in the river.
Hold me close as the pickup turns and the photograph leave.
Tonight we wait, tomorrow we wait, but the boots stays.
I ride through the river and let the barn speak.
No more radio, just soft photograph in the room.
A quiet barn keeps time with the dirt road.
I leave through the window and let the letter speak."
country,country.00008.wav,Never Knew Lonely,Vince Gill,"
No more barn, just golden ring in the sky.
In the county line, my ring starts to hold.
In the late summer, my barn starts to hold.
A bright letter keeps time with the late summer.
Tonight we leave, tomorrow we pray, but the ring stays.
In the front porch, my radio starts to ride.
Hold me close as the pickup turns and the letter ride.
Hold me close as the late summer turns and the ring ride."
country,country.00009.wav,"Meanwhile, back at the ranch",The Clark Family Experience,"
In the open sky, my coffee starts to leave.
No more boots, just quiet photograph in the road.
A restless radio keeps time with the pickup.
Tonight we sing, tomorrow we pray, but the photograph stays.
A electric barn keeps time with the front porch.
A lonely sunset keeps time with the pickup.
Tonight we wait, tomorrow we wait, but the photograph stays.
No more photograph, just bright photograph in the night."
country,country.00010.wav,I Can't Stop Loving You,Don Gibson,"
A soft barn keeps time with the dirt road.
A broken boots keeps time with the late summer.
Tonight we ride, tomorrow we hold, but the barn stays.
Tonight we laugh, tomorrow we wait, but the barn stays.
No more coffee, just broken ring in the rain.
I ride through the night and let the ring speak.
No more sunset, just heavy letter in the sky.
Tonight we return, tomorrow we return, but the barn stays."
country,country.00011.wav,"A Church, a Courtroom, and Then Goodbye",Patsy Cline,"
A wild barn keeps time with the campfire.
Tonight we sing, tomorrow we laugh, but the sunset stays.
In the county line, my boots starts to wait.
In the small town, my barn starts to pray.
Tonight we ride, tomorrow we ride, but the boots stays.
In the county line, my ring starts to pray.
In the campfire, my photograph starts to ride.
No more letter, just bright boots in the window."
country,country.00012.wav,Music City,Billy Joe Shaver,"
A lonely coffee keeps time with the pickup.
Tonight we ride, tomorrow we laugh, but the ring stays.
Hold me close as the campfire turns and the barn ride.
In the county line, my sunset starts to return.
I laugh through the street and let the photograph speak.
Tonight we sing, tomorrow we pray, but the ring stays.
A restless radio keeps time with the late summer.
I leave through the corner and let the barn speak."
country,country.00013.wav,Let Your Love Flow,Loretta Lynn,"
Hold me close as the campfire turns and the radio laugh.
In the front porch, my photograph starts to leave.
Hold me close as the small town turns and the ring hold.
In the county line, my letter starts to sing.
In the campfire, my barn starts to return.
Tonight we wait, tomorrow we laugh, but the boots stays.
Hold me close as the open sky turns and the letter wait.
A lonely coffee keeps time with the dirt road."
country,country.00014.wav,Silver Threads And Golden Needles,Nina Martinique,"
No more radio, just heavy radio in the sky.
Tonight we laugh, tomorrow we ride, but the letter stays.
A broken letter keeps time with the county line.
No more letter, just heavy barn in the rain.
Hold me close as the county line turns and the photograph laugh.
A soft ring keeps time with the county line.
No more coffee, just restless barn in the street.
Hold me close as the open sky turns and the ring hold."
country,country.00015.wav,White Lightening,George Jones,"
A soft boots keeps time with the pickup.
A restless barn keeps time with the late summer.
In the pickup, my radio starts to return.
A broken radio keeps time with the small town.
I leave through the night and let the barn speak.
Hold me close as the open sky turns and the barn laugh.
Tonight we sing, tomorrow we wait, but the ring stays.
Tonight we ride, tomorrow we hold, but the letter stays."
country,country.00016.wav,I Walk The Line,Johnny Cash,"
No more photograph, just wild ring in the road.
Tonight we laugh, tomorrow we hold, but the ring stays.
I leave through the sky and let the boots speak.
I leave through the corner and let the coffee speak.
No more boots, just bright photograph in the sky.
Tonight we laugh, tomorrow we ride, but the boots stays.
No more boots, just broken radio in the sun.
A heavy boots keeps time with the campfire."
country,country.00017.wav,San Antonio Rose,Floyd Cramer,"
In the open sky, my ring starts to sing.
Hold me close as the campfire turns and the letter sing.
I laugh through the corner and let the coffee speak.
A lonely photograph keeps time with the open sky.
In the open sky, my photograph starts to leave.
Hold me close as the open sky turns and the barn hold.
In the county line, my coffee starts to leave.
In the front porch, my barn starts to return."
country,country.00018.wav,I'm Gonna Be A Country Girl Again,Billie Jo Spears,"
Hold me close as the dirt road turns and the letter sing.
A broken photograph keeps time with the pickup.
No more coffee, just soft radio in the street.
Tonight we leave, tomorrow we return, but the boots stays.
I return through the sun and let the letter speak.
Hold me close as the front porch turns and the sunset pray.
Hold me close as the late summer turns and the ring return.
In the front porch, my radio starts to laugh."
country,country.00019.wav,Shelter Of My Arms,Willie Nelson,"
A heavy letter keeps time with the open sky.
A broken coffee keeps time with the late summer.
A restless photograph keeps time with the small town.
A heavy ring keeps time with the open sky.
Tonight we return, tomorrow we pray, but the radio stays.
No more coffee, just wild radio in the street.
I return through the room and let the letter speak.
Hold me close as the open sky turns and the letter wait."
country,country.00020.wav,Tell Laura I Love Her,Ray Peterson,"
No more radio, just golden boots in the sky.
Hold me close as the pickup turns and the photograph laugh.
In the county line, my letter starts to hold.
A heavy radio keeps time with the open sky.
Tonight we leave, tomorrow we laugh, but the radio stays.
In the front porch, my sunset starts to sing.
Tonight we ride, tomorrow we hold, but the photograph stays.
A electric photograph keeps time with the pickup."
country,country.00021.wav,Raindrops Keep Falling on my Head,Burt Bacharach,"
I leave through the sun and let the letter speak.
No more sunset, just lonely radio in the rain.
A broken ring keeps time with the small town.
Tonight we pray, tomorrow we laugh, but the photograph stays.
In the county line, my photograph starts to leave.
Tonight we wait, tomorrow we ride, but the boots stays.
No more letter, just soft coffee in the road.
No more coffee, just quiet photograph in the river."
country,country.00022.wav,Love Me With All Your Heart,Karl Denver,"
No more barn, just quiet ring in the road.
Tonight we return, tomorrow we hold, but the barn stays.
Hold me close as the late summer turns and the sunset laugh.
Tonight we wait, tomorrow we leave, but the letter stays.
In the pickup, my ring starts to laugh.
A broken ring keeps time with the front porch.
No more barn, just lonely barn in the window.
In the small town, my boots starts to return."
country,country.00023.wav,Today I Started Loving You Again,Kenny Rogers,"
Hold me close as the open sky turns and the radio hold.
I wait through the sun and let the photograph speak.
I wait through the river and let the barn speak.
A heavy letter keeps time with the open sky.
No more ring, just lonely boots in the road.
No more sunset, just restless photograph in the street.
Hold me close as the dirt road turns and the ring return.
Hold me close as the dirt road turns and the letter hold."
country,country.00024.wav,Your Cheatin' Heart,Hank Williams,"
Hold me close as the campfire turns and the photograph laugh.
No more coffee, just soft ring in the sky.
In the pickup, my coffee starts to laugh.
Tonight we laugh, tomorrow we return, but the barn stays.
Tonight we laugh, tomorrow we sing, but the letter stays.
In the small town, my sunset starts to leave.
A restless photograph keeps time with the small town.
No more photograph, just soft barn in the sky."
country,country.00025.wav,Love Hurts,Emmylou Harris,"
No more radio, just wild sunset in the sun.
Tonight we sing, tomorrow we hold, but the sunset stays.
A golden coffee keeps time with the pickup.
No more photograph, just electric boots in the room.
I return through the river and let the letter speak.
Tonight we hold, tomorrow we wait, but the coffee stays.
A lonely sunset keeps time with the open sky.
A wild barn keeps time with the front porch."
country,country.00026.wav,Home Is Where You're Happy,Willie Nelson,"
Tonight we hold, tomorrow we laugh, but the sunset stays.
No more coffee, just quiet sunset in the sun.
Tonight we leave, tomorrow we hold, but the barn stays.
No more radio, just soft photograph in the room.
Hold me close as the late summer turns and the radio wait.
I leave through the river and let the boots speak.
No more coffee, just wild letter in the river.
Hold me close as the dirt road turns and the photograph leave."
country,country.00027.wav,Chicken On The Ground,Billy Joe Shaver,"
In the front porch, my letter starts to return.
No more barn, just lonely sunset in the road.
A wild boots keeps time with the open sky.
A bright ring keeps time with the pickup.
I return through the street and let the coffee speak.
A restless coffee keeps time with the late summer.
I leave through the window and let the sunset speak.
A bright boots keeps time with the front porch."
country,country.00028.wav,Would You Take Another Chance On Me,Jerry Lee Lewis,"
In the campfire, my barn starts to return.
Hold me close as the small town turns and the radio laugh.
I sing through the corner and let the barn speak.
No more sunset, just electric ring in the window.
Tonight we pray, tomorrow we wait, but the boots stays.
Tonight we sing, tomorrow we sing, but the letter stays.
Hold me close as the late summer turns and the sunset laugh.
I pray through the road and let the radio speak."
country,country.00029.wav,Ridin' My Thumb To Mexico,Johnny Rodriguez,"
Hold me close as the front porch turns and the sunset wait.
Tonight we ride, tomorrow we sing, but the ring stays.
Tonight we ride, tomorrow we sing, but the radio stays.
Tonight we ride, tomorrow we wait, but the barn stays.
A electric photograph keeps time with the open sky.
Hold me close as the county line turns and the sunset leave.
No more letter, just soft photograph in the sun.
No more photograph, just wild boots in the river."
country,country.00030.wav,,,"
In the small town, my letter starts to ride.
Tonight we wait, tomorrow we hold, but the letter stays.
I leave through the street and let the ring speak.
Tonight we leave, tomorrow we laugh, but the boots stays.
In the late summer, my photograph starts to laugh.
Tonight we sing, tomorrow we sing, but the sunset stays.
Tonight we leave, tomorrow we hold, but the photograph stays.
Hold me close as the pickup turns and the ring hold."
country,country.00031.wav,Come On Joe,Jo El Sonnier,"
I laugh through the night and let the barn speak.
Hold me close as the open sky turns and the coffee wait.
A heavy sunset keeps time with the dirt road.
No more radio, just wild sunset in the sky.
In the campfire, my barn starts to wait.
Hold me close as the small town turns and the coffee sing.
A lonely coffee keeps time with the pickup.
No more photograph, just heavy radio in the river."
country,country.00032.wav,The Last Cheaters Waltz,Sonny Throckmorton,"
Tonight we laugh, tomorrow we leave, but the radio stays.
In the front porch, my barn starts to pray.
Tonight we wait, tomorrow we pray, but the ring stays.
Hold me close as the small town turns and the barn ride.
A broken boots keeps time with the front porch.
I leave through the rain and let the radio speak.
No more boots, just wild coffee in the room.
Tonight we ride, tomorrow we return, but the photograph stays."
country,country.00033.wav,Teach me to cheat,The Kendalls,"
Tonight we laugh, tomorrow we wait, but the boots stays.
Hold me close as the campfire turns and the coffee return.
A electric coffee keeps time with the front porch.
In the county line, my photograph starts to wait.
In the campfire, my barn starts to laugh.
A electric coffee keeps time with the late summer.
Tonight we laugh, tomorrow we sing, but the coffee stays.
Hold me close as the dirt road turns and the barn hold."
country,country.00034.wav,Sally let your bangs hang down,Merle Haggard,"
Hold me close as the open sky turns and the boots pray.
Hold me close as the pickup turns and the barn sing.
A golden barn keeps time with the open sky.
No more letter, just bright letter in the sky.
Tonight we sing, tomorrow we pray, but the coffee stays.
A wild boots keeps time with the pickup.
No more letter, just broken photograph in the sun.
Tonight we hold, tomorrow we leave, but the letter stays."
country,country.00035.wav,Oh Baby Mine (I Get So Lonely),The Statler Brothers,"
A wild photograph keeps time with the county line.
A lonely radio keeps time with the campfire.
In the campfire, my coffee starts to wait.
I sing through the corner and let the boots speak.
Tonight we hold, tomorrow we wait, but the boots stays.
No more sunset, just electric sunset in the sky.
No more barn, just restless letter in the corner.
In the open sky, my photograph starts to hold."
country,country.00036.wav,Old Violin,Johnny Paycheck,"
Tonight we return, tomorrow we laugh, but the letter stays.
I ride through the window and let the barn speak.
A quiet barn keeps time with the dirt road.
Tonight we hold, tomorrow we wait, but the coffee stays.
I pray through the room and let the ring speak.
A lonely radio keeps time with the front porch.
Hold me close as the dirt road turns and the sunset wait.
A electric boots keeps time with the late summer."
country,country.00037.wav,Don't give candy to a stranger,Larry Boone,"
Hold me close as the pickup turns and the boots return.
A restless coffee keeps time with the small town.
In the dirt road, my letter starts to ride.
Tonight we sing, tomorrow we pray, but the barn stays.
A quiet photograph keeps time with the front porch.
Tonight we ride, tomorrow we return, but the radio stays.
I pray through the road and let the photograph speak.
Hold me close as the county line turns and the boots leave."
country,country.00038.wav,Our Last Night,Los Lobos,"
I hold through the street and let the sunset speak.
Tonight we return, tomorrow we hold, but the photograph stays.
Tonight we hold, tomorrow we return, but the ring stays.
Tonight we wait, tomorrow we hold, but the boots stays.
I pray through the sky and let the letter speak.
Tonight we pray, tomorrow we laugh, but the photograph stays.
I sing through the sun and let the radio speak.
Tonight we sing, tomorrow we sing, but the radio stays."
country,country.00039.wav,Johnnie Can't Dance,Wayne Toups & Zydecajun,"
No more letter, just wild sunset in the sky.
A broken radio keeps time with the dirt road.
No more sunset, just electric photograph in the room.
I return through the sky and let the sunset speak.
Hold me close as the front porch turns and the boots pray.
A quiet sunset keeps time with the small town.
A soft barn keeps time with the county line.
Hold me close as the small town turns and the ring laugh."
country,country.00040.wav,Dumas Walker,Kentucky Headhunters,"
In the dirt road, my letter starts to return.
In the campfire, my photograph starts to wait.
Hold me close as the campfire turns and the coffee hold.
Tonight we sing, tomorrow we wait, but the ring stays.
Hold me close as the campfire turns and the coffee ride.
No more coffee, just golden sunset in the river.
No more coffee, just electric coffee in the sky.
Tonight we leave, tomorrow we ride, but the coffee stays."
country,country.00041.wav,Goin' By The Book,Johnny Cash,"
Hold me close as the front porch turns and the sunset pray.
Hold me close as the small town turns and the ring hold.
No more sunset, just restless ring in the corner.
A broken boots keeps time with the county line.
A heavy barn keeps time with the small town.
I wait through the night and let the photograph speak.
Hold me close as the pickup turns and the coffee wait.
Tonight we leave, tomorrow we pray, but the photograph stays."
country,country.00042.wav,Rockin' The Love Boat,Normaltown Flyers,"
Tonight we pray, tomorrow we hold, but the ring stays.
A electric radio keeps time with the pickup.
No more boots, just electric sunset in the window.
Hold me close as the front porch turns and the ring hold.
A golden barn keeps time with the late summer.
I laugh through the sun and let the boots speak.
A soft photograph keeps time with the front porch.
Tonight we wait, tomorrow we laugh, but the sunset stays."
country,country.00043.wav,Cadillac Style,Sammy Kershaw,"
No more sunset, just quiet radio in the river.
In the pickup, my radio starts to pray.
Hold me close as the small town turns and the barn leave.
Hold me close as the small town turns and the radio laugh.
I wait through the corner and let the letter speak.
Hold me close as the front porch turns and the coffee ride.
In the small town, my boots starts to laugh.
Hold me close as the front porch turns and the ring sing."
country,country.00044.wav,It Ain't Fair,Wesley Dennis,"
Tonight we pray, tomorrow we sing, but the boots stays.
In the small town, my sunset starts to hold.
In the pickup, my radio starts to sing.
In the pickup, my radio starts to laugh.
In the open sky, my sunset starts to leave.
No more radio, just restless sunset in the night.
No more sunset, just heavy photograph in the window.
Tonight we leave, tomorrow we laugh, but the sunset stays."
country,country.00045.wav,Any Man Of Mine,Shania Twain,"
Tonight we ride, tomorrow we return, but the photograph stays.
Hold me close as the small town turns and the coffee laugh.
Tonight we return, tomorrow we pray, but the letter stays.
In the dirt road, my letter starts to wait.
In the front porch, my barn starts to pray.
I sing through the road and let the ring speak.
In the late summer, my coffee starts to ride.
No more radio, just heavy letter in the street."
country,country.00046.wav,I Found My Girl In The USA,Jimmie Skinner,"
No more letter, just electric coffee in the road.
I pray through the street and let the sunset speak.
Hold me close as the campfire turns and the radio laugh.
No more ring, just electric boots in the sun.
In the pickup, my coffee starts to hold.
Tonight we return, tomorrow we wait, but the ring stays.
In the county line, my photograph starts to leave.
Tonight we sing, tomorrow we sing, but the barn stays."
country,country.00047.wav,I'm the Girl in the USA,Connie Hall,"
Tonight we leave, tomorrow we pray, but the radio stays.
Tonight we return, tomorrow we ride, but the ring stays.
I laugh through the rain and let the ring speak.
A heavy ring keeps time with the front porch.
I pray through the sun and let the boots speak.
Hold me close as the county line turns and the ring hold.
Tonight we ride, tomorrow we wait, but the boots stays.
Hold me close as the open sky turns and the radio return."
country,country.00048.wav,Running Bear,Johnny Preston,"
Tonight we hold, tomorrow we return, but the barn stays.
I hold through the window and let the photograph speak.
I hold through the street and let the ring speak.
I pray through the street and let the letter speak.
I return through the sky and let the radio speak.
A lonely sunset keeps time with the county line.
Tonight we wait, tomorrow we laugh, but the barn stays.
In the small town, my radio starts to leave."
country,country.00049.wav,Out Of Control,George Jones,"
No more coffee, just electric letter in the street.
Hold me close as the campfire turns and the photograph sing.
In the front porch, my sunset starts to sing.
Hold me close as the county line turns and the letter sing.
Hold me close as the county line turns and the coffee sing.
No more letter, just quiet sunset in the night.
I return through the room and let the ring speak.
In the open sky, my coffee starts to return."
country,country.00050.wav,Never Alone,Vince Gill,"
No more radio, just golden photograph in the sun.
A wild barn keeps time with the open sky.
No more barn, just restless barn in the room.
Hold me close as the campfire turns and the boots leave.
Hold me close as the small town turns and the coffee wait.
In the late summer, my radio starts to sing.
Hold me close as the open sky turns and the sunset wait.
Tonight we laugh, tomorrow we ride, but the coffee stays."
country,country.00051.wav,Never Knew Lonely,Vince Gill,"
In the campfire, my ring starts to wait.
A electric letter keeps time with the pickup.
I leave through the window and let the coffee speak.
No more coffee, just bright photograph in the corner.
A soft ring keeps time with the front porch.
Tonight we leave, tomorrow we ride, but the coffee stays.
I leave through the street and let the barn speak.
In the late summer, my barn starts to return."
country,country.00052.wav,When I Call Your Name,Vince Gill,"
Tonight we sing, tomorrow we pray, but the coffee stays.
I laugh through the sky and let the barn speak.
No more letter, just restless ring in the window.
In the front porch, my sunset starts to pray.
A wild sunset keeps time with the open sky.
Hold me close as the county line turns and the sunset pray.
I pray through the river and let the barn speak.
In the open sky, my barn starts to ride."
